category,order,question,answer
Manche 1,1,Comment appelle-t-on l'anniversaire que l'on célèbre après un an de mariage ?,Les noces de coton
Manche 1,2,Quel film de Luc Besson a pour titre le nom d'une navette spatiale ?,Atlantis
Manche 1,3,"Dans Babar, quel est le nom de la reine des éléphants ?",Céleste
Manche 1,4,"Quelle artiste britannique a sorti quatre albums au total : “19”, “21”, “25” et “30” ?",Adèle
Manche 1,5,"Dans le générique de “La Petite Maison dans la Prairie”, comment s'appelle la petite fille qui chute accidentellement dans le pré ?",Carrie ou Caroline Celestia
Manche 1,6,"Qui portait le matricule ""46664"" alors qu'il était prisonnier à Robben Island ?",Nelson Mandela ou Nelson Rolihlahla Mandela
Manche 1,7,"Quel est le nom de famille du peintre impressionniste prénommé Auguste, et de son fils cinéaste, prénommé Jean ?",Renoir
Manche 1,8,Comment s'appelait le premier avion supersonique commercial ?,Concorde
Manche 1,9,Sur quelle île de l'océan Indien se trouvent le piton des Neiges et le piton de la Fournaise ?,La Réunion
Manche 1,10,"En novembre 1970, après la mort du général de Gaulle, quel journal a eu pour phrase de titre : ""Bal tragique à Colombey - 1 mort"" ?",Hara Kiri
Manche 1,11,Quel document contient l'identité du titulaire d'un compte et ses coordonnées bancaires ?,Un relevé d'identité bancaire
Manche 1,12,Quel joueur de tennis a remporté le tournoi de Wimbledon en 2024 ?,Carlos Alcaraz
Manche 1,13,"De quel roman de Dostoïevski publié en 1866, Raskolnikov est-il le héros ?",Crime et Châtiment
Manche 1,14,Quelle chanteuse canadienne a réinterprété le titre “Dernière Danse” de Kyo en 2023 ?,Cœur de Pirate
Manche 1,15,"En janvier 2025, quelle personnalité américaine enregistre le plus grand nombre d'abonnés sur Youtube ?",MrBeast
Manche 1,16,Qui fut le second président de la IVe République ?,René Coty
Manche 1,17,"À la Belote, quelles sont les deux plus fortes cartes à l'atout ?",Valet et neuf
Manche 1,18,Quelle est la racine carrée de 144 ?,Douze
Manche 1,19,Quel État membre de l'Union européenne est à la fois voisin de la Lituanie et de l'Estonie ?,La Lettonie
Manche 1,20,"Quel pilote, considéré comme une légende du rallye, a remporté 9 titres consécutifs en WRC entre 2004 et 2022 ?",Sébastien Loeb
Manche 1,21,"Comment appelle-t-on le trou d'une aiguille, où passe le fil ?",Le chas
Manche 1,22,"Dans le sigle américain ""FBI"", à quel mot correspond la lettre ""F"" ?",Federal
Manche 1,23,"Quelle rivière d'Europe centrale a un nom qui désigne, en langage familier français, une flatulence ?",La prout
Manche 1,24,Sur quelle pochette d'un album de Nirvana voit-on un bébé qui nage vers un billet retenu par un hameçon ?,Nevermind
Manche 1,25,"Qu'est-ce qui peut être ""de fa"", ""anglaise"" ou à ""molette"" ?",Une clé
Manche 1,26,"Quelle préparation culinaire peut être ""norvégienne"" quand elle est sucrée et ""aux fines herbes"" quand elle est salée ?",L'omelette
Manche 1,27,"Au football, quel est le nom de la zone rectangulaire délimitée à 16,50 m de la ligne de but ?",La surface de réparation
Manche 1,28,À quelle famille d'instruments de musique appartiennent le bongo et le triangle ?,Les instruments à percussion
Manche 1,29,Combien de grammes compte un kilogramme ?,Mille
Manche 1,30,Quelle est l'avant-dernière voyelle de notre alphabet ?,U
Connaissance du monde,1,Quel nom portait l'épée magique du roi Arthur ?,Excalibur
Connaissance du monde,2,Quel nom donne-t-on aux habitants de la Nouvelle-Zélande ?,Les Néo-Zélandais
Connaissance du monde,3,Sur quelle île d'Italie se trouve la ville de Catane ?,La Sicile
Connaissance du monde,4,"Quel nom désigne à la fois l'arbuste à baies noires, proche du groseillier, et le contraire d'un dos d'âne ?",Le cassis
Connaissance du monde,5,"Quel animal, réputé pour vivre dans le feu, était l'emblème de François Ier ?",Une salamandre
Connaissance du monde,1,Quel nom désigne les bidonvilles brésiliens ?,Une favela
Connaissance du monde,2,Avec quel État la Corée du Sud a-t-elle une frontière terrestre au nord ?,La Corée du Nord
Connaissance du monde,3,Quelle ville est le chef-lieu du département de la Côte-d'Or ?,Dijon
Connaissance du monde,4,"En quelle année a été signé le traité de Maastricht, créant ainsi l'Union européenne ?",1992
Connaissance du monde,5,"A Grenade, quel nom porte la résidence des anciens princes arabes, célèbre pour ses jardins ?",L'Alhambra
Connaissance du monde,Départage,Quel animal est le symbole actuel de la ville de Berlin ?,L'ours
Connaissance du monde,Départage,Quel type de pont est caractérisé par son tablier qui se lève et se baisse pour ouvrir ou fermer l'entrée d'un château-fort ?,Un pont-levis
Loisirs et sports,1,"A la télévision française, qu'y a-t-il d'écrit sur la case noire de ""La Roue de la fortune"" ?",Banqueroute
Loisirs et sports,2,"Au tennis, quel est le seul tournoi du Grand Chelem à se dérouler sur gazon ?",Wimbledon
Loisirs et sports,3,Quelle icône de la mode est la rédactrice en chef de l'édition américaine du magazine Vogue depuis 1988 ?,Anna Wintour
Loisirs et sports,4,"Quelle série de jeux vidéos, se déroulant dans le royaume d'Hyrule, met en scène le personnage de Link ?",Zelda
Loisirs et sports,5,Quel est le dernier coureur cycliste français à avoir remporté le Tour de France ?,Bernard Hinault
Loisirs et sports,1,"À skis, quel freinage consiste à écarter les talons en rapprochant l'avant des spatules ?",Le chasse-neige
Loisirs et sports,2,Quel est le nom de l’héroïne emblématique de la saga de jeux vidéos Tomb Raider ?,Lara Croft
Loisirs et sports,3,Quel “Dominique” est connu pour être le présentateur de l'émission “Turbo” sur M6 depuis plus de 35 ans ?,Dominique Chapatte
Loisirs et sports,4,"Quel handballeur, natif de la Réunion, a été élu meilleur joueur du monde en 1995 ?",Jackson Richardson
Loisirs et sports,5,"Au football, combien de fois le Real Madrid a-t-il remporté la Ligue des Champions ?",15
Loisirs et sports,Départage,Que représentent les cinq anneaux sur le drapeau des Jeux olympiques ?,L'union des cinq continents ou Les continents
Loisirs et sports,Départage,Quel athlète jamaïcain détient les records du monde du 100 mètres et du 200 mètres ?,Usain Bolt
Pop culture,1,"En 1979, quel chanteur rencontra le succès avec : ""Je l'aime à mourir"" ?",Francis Cabrel
Pop culture,2,"En 2008, quel film retrace les fabuleuses aventures d'un indien malchanceux devenant riche grâce à un jeu télévisé ?",Slumdog Millionaire
Pop culture,3,"Dans les années 1970, à quel chanteur de soul américain doit-on les tubes : ""Isn't She Lovely"" et ""Superstition ?",Stevie Wonder (ou Steveland Judkins-Morris)
Pop culture,4,Quel journaliste et animateur de télévision apprend à jouer aux jeux vidéos sur Twitch depuis 2023 ?,Samuel Étienne
Pop culture,5,"Dans la bande dessinée Tintin, à quel pirate cruel associe-t-on le trésor de la Licorne ?",Rackham Le Rouge
Pop culture,1,Quel film des Inconnus remporte le “César de la Meilleure Première Oeuvre” devenu aujourd'hui “Meilleur premier film” ?,Les Trois Frères
Pop culture,2,"À quel artiste jamaïquain doit-on la chanson ""I Shot The Sheriff"" ?",Bob Marley
Pop culture,3,Quel lapin hystérique est marié à la sublime Jessica dans un film d'animation sorti en 1988 ?,Roger Rabbit
Pop culture,4,"Quelle chanteuse Noire américaine obtient un grand succès en 1985 avec ""We Don't Need Another Hero"" ?",Tina Turner
Pop culture,5,En quelle année avant Jésus Christ les aventures d'Astérix débutent-elles ?,50 (avant J.C.)
Pop culture,Départage,"Quel humoriste français a réalisé le film intitulé ""Fatal"", sorti en 2010 ?",Michaël Youn
Pop culture,Départage,"Dans la saga Harry Potter, comment s’appelle la chouette du jeune sorcier ?",Hedwige
Savoirs académiques,1,Quel nom porte le côté d'un triangle rectangle opposé à l'angle droit ?,Hypoténuse
Savoirs académiques,2,Quelle déesse grecque de la Guerre et de la Raison naquit en sortant tout armée du crâne de Zeus ?,Athéna
Savoirs académiques,3,"A quel peintre français, ami de Van Gogh, doit-on le tableau ""Femmes de Tahiti"" ?",Paul Gauguin
Savoirs académiques,4,"Qui est l'auteur de la comédie Le jeu de l'amour et du hasard, créée à Paris en 1730 ?",Marivaux
Savoirs académiques,5,"Quelle unité de mesure de force, qui a pour symbole la lettre ""N"", tient son nom d'un physicien anglais ?",Le newton
Savoirs académiques,1,"Dans la mythologie grecque, comment se prénomme le chien à plusieurs têtes qui garde l'entrée des Enfers ?",Cerbère
Savoirs académiques,2,"Quel chimiste du 18ème siècle aurait déclaré : « rien ne se perd, rien ne se crée, tout se transforme » ?",Antoine de Lavoisier
Savoirs académiques,3,"Quel philosophe, est l'auteur de la pièce : ""Huis clos"" ?",Jean-Paul Sartre
Savoirs académiques,4,"En informatique, combien faut-il de bits pour faire un octet ?",8
Savoirs académiques,5,"Quel sociologue français, disparu en 2002, est l'auteur des ouvrages Les héritiers et de La distinction ?",Pierre Bourdieu
Savoirs académiques,Départage,En quelle année le mur de Berlin est-il tombé ?,1989
Savoirs académiques,Départage,"Quel squelette appartenant à la lignée humaine a été découvert en 1974 sur le site de Hadar, en Éthiopie ?",Lucy (australopithèque)
Vie quotidienne,1,"Dans la comptine ""Ah ! les crocodiles"", sur les bords de quel fleuve les crocodiles sont-ils partis ?",Le Nil
Vie quotidienne,2,"Dans le domaine de la santé, que signifie le “P” du sigle C.P.A.M. ?",Primaire
Vie quotidienne,3,De quelle plante légumineuse tropicale la cacahuète est-elle le fruit ?,L'arachide
Vie quotidienne,4,"En cuisine, quel verbe désigne l'action de dissoudre les sucs de cuisson à l'aide d'un liquide, pour obtenir une sauce ?",Déglacer
Vie quotidienne,5,"Quelle plante cultivée pour sa racine, dont le nom vient du suédois, est voisine du navet et est appelée : ""chou de Siam"" ?",Le rutabaga
Vie quotidienne,1,"À la maison, quel objet est familièrement appelé la ""zappette"" ?",La télécommande
Vie quotidienne,2,"Dans le premier couplet de La Marseillaise, quelle est la seule phrase à faire l'objet d'un bis ?",L'étendard sanglant est levé !
Vie quotidienne,3,"Quel instrument de musique, de la famille du luth, est l'homonyme d'un ustensile de cuisine servant à émincer les légumes ?",Une mandoline
Vie quotidienne,4,"Quelle est la substance active qui compose le Doliprane, le Dafalgan et Efferalgan ?",Le paracétamol
Vie quotidienne,5,"Quelle plante vivace est une variété proche du thym, ce qui lui vaut le surnom “d'origan des jardins” ?",La marjolaine
Vie quotidienne,Départage,"Dans quel apéritif à base de vin rouge additionné de sucre, fait-on macérer des fruits de saison coupés en morceaux ?",La sangria
Vie quotidienne,Départage,"Comment appelle-t-on l'alphabet conventionnel en relief, à l'usage des non-voyants ?",Le braille
Éliminatoire,1,"Lésion courante et superficielle, mais douloureuse, je guéris spontanément et peux être soignée avec du vinaigre ; touchant toutes les populations, je me développe suite à une prolifération de bactéries ou à l'ingestion de certains aliments ; si je suis récurrente, je peux évoquer des pathologies digestives ; ulcère de la muqueuse buccale se formant sur la langue ou sur l'intérieur des lèvres, mon nom vient du grec, apto, signifiant brûler... Je suis :",Un aphte
Éliminatoire,2,"Type d'opération militaire qui aurait eu lieu pour la première fois en 490 avant J.C. ; mon exemple le plus connu s'est déroulé en Normandie ; consistant à déployer sur la côte des soldats et du matériel militaire, en vue d'une invasion ; associé à la plage d'Omaha Beach ; le film ""Il faut sauver le soldat Ryan"" de Steven Spielberg est basé sur l'une de mes histoires... Je suis :",Un débarquement
Éliminatoire,3,"Sous l'influence de mon fondateur né en 1926, mon premier magasin ouvre à Älmuhlt ; chacun de mes employés reçoit le ""Testament d'un négociant en meubles"" ; connu sous un acronyme de 4 lettres, mon activité est la conception et la vente de mobilier en kit et d'objets de décoration ; mes 2 couleurs distinctives correspondent à celles de mon pays d'origine... Je suis :",IKEA
Éliminatoire,4,"Équipe sportive ayant joué mon premier match officiel en 1903, je suis la seule équipe dans ma discipline à avoir remporté 3 coupes du monde ; mon surnom apparaît pour la première fois dans un compte-rendu de match en 1905 ; mon sélectionneur actuel est Stebe Hansen et Jonah Lomu a été l'une de mes figures marquantes ; mes rugbymen portant un maillot noir sont célèbres pour le rituel du haka... Je suis :",Les All Blacks
Finale,Connaissance du monde 1,"Quelle unité de mesure de masse de 0,2 gramme est utilisée dans le commerce des diamants ?",Le carat
Finale,Connaissance du monde 2,Dans quel quartier de New York se trouve Wall Street ?,Manhattan
Finale,Connaissance du monde 3,"En France, quel nom est donné au siège du président du Sénat ?",Le plateau
Finale,Loisirs et sports 1,"Présenté aux USA en 1968, quel dispositif de pointage sur écran deviendra ensuite indispensable à l'utilisation des ordinateurs ?",La souris
Finale,Loisirs et sports 2,Quel pilote a remporté le championnat du monde de Formule 1 en 2024 ?,Max Verstappen
Finale,Loisirs et sports 3,Comment appelle-t-on un amateur de course de taureaux ?,Un aficionado
Finale,Pop culture 1,"Quel groupe pop-rock a fait un tube avec le titre ""Roxanne"" à la fin des années 70 ?",The Police
Finale,Pop culture 2,Quel célèbre manga d’Akira Toriyama a contribué à populariser le genre shōnen dans les années 1980 ?,Dragon Ball
Finale,Pop culture 3,"A quel groupe féminin américain doit-on les tubes des années 60 : ""Stop ! In the Name of Love"" et ""The Happening"" ?",Les Supremes
Finale,Savoirs académiques 1,"Dans quel film Yves Montand susurre-t-il à Louis de Funès : “Il est l'or, l'or de se réveiller, mon seignor, il est huit or...” ?",La Folie des grandeurs
Finale,Savoirs académiques 2,Quel nom spécifique désigne les deux dernières paires de côtes ?,Côtes flottantes
Finale,Savoirs académiques 3,"En 1888, quel philosophe allemand écrit un ouvrage intitulé ""Ecce Homo"" ?",Friedrich Nietzsche
Finale,Vie quotidienne 1,"Que désigne la lettre ""S"", de l'acronyme S.A.M.U. ?",Service
Finale,Vie quotidienne 2,"En botanique, comment s'appelle l'enveloppe du marron, de la châtaigne recouverte de piquants ?",La bogue
Finale,Vie quotidienne 3,"À quel grand peintre abstrait, la firme Renault a-t-elle fait appel en 1972 afin de rajeunir son logo ?",Victor Vasarely
Super Finale,Pop culture 1,Dans quel jeu de société un meurtre peut-il être commis par le colonel Moutarde dans la salle à manger ?,Le Cluedo
Super Finale,Pop culture 1,"Dans quelle série d'animation culte, Stan Marsh s'écrie-t-il régulièrement : ""Oh mon Dieu, ils ont tué Kenny !"" ?",South Park
Super Finale,Loisirs et sports 2,"Quel ancien champion du monde de football est monté sur les planches en 2010 dans une pièce intitulée ""L'Intrus"" ?",Franck Leboeuf
Super Finale,Loisirs et sports 2,"De quel couturier français, l'actrice américaine Audrey Hepburn était-elle l'égérie ?",Hubert de Givenchy ou Givenchy
Super Finale,Vie quotidienne 3,Contre quelle maladie le vaccin B.C.G. nous protège-t-il ?,La tuberculose
Super Finale,Vie quotidienne 3,"Quel mot comportant deux ""Z"" désigne l'assortiment de hors-d'œuvre, le plus souvent froids, de la cuisine orientale ?",Mezze
Super Finale,Connaissance du monde 4,"Quel État européen a pour devise : ""Dieu et mon droit"" ?",La Grande-Bretagne ou le Royaume-Uni
Super Finale,Connaissance du monde 4,Quelle mer intérieure de la Méditerranée borde les côtes de l'île grecque appelée Lesbos ?,La mer Égée
Super Finale,Savoirs académiques 5,De quel phénomène naturel l'échelle de Beaufort mesure-t-elle la force ?,Le vent
Super Finale,Savoirs académiques 5,"À quel auteur brésilien doit-on le roman ""L'Alchimiste"" ?",Paulo Coelho
Super Finale,Mort subite 1,"Selon l'expression, lorsque l'on vit de façon excessive, que ""brûle-t-on par les deux bouts"" ?",La chandelle
Super Finale,Mort subite 2,"Dans quel film de 1984, un groupe de scientifiques, emmené par Bill Murray, fonde une société destinée à chasser les revenants",S.O.S. Fantômes ou Ghostbusters
Super Finale,Mort subite 3,Dans quel sport s'est illustrée Suzanne Lenglen dans les années 1920 ?,Le tennis
Super Finale,Mort subite 4,"De quel pays était originaire Garcimore, le magicien maladroit, complice de Denis Fabre à la télévision ?",L'Espagne
Super Finale,Mort subite 5,Dans la gastronomie de quel pays peut-on déguster des beignets appelés tempura ?,Le Japon
Super Finale,Mort subite 6,"Comment appelle-t-on le fait de ne pas participer à un vote, pour un citoyen inscrit sur les listes électorales ?",L'abstention
Super Finale,Mort subite 7,Quels sont les deux seuls États d'Amérique du Sud privés de littoral marin ?,La Bolivie et le Paraguay
Super Finale,Mort subite 8,"Combien de pattes possède le griffon, animal fabuleux à tête d'aigle ?",Quatre
Super Finale,Mort subite 9,"Au IVe siècle avant J.-C., quel philosophe grec considéré comme le père de la logique fut le précepteur d'Alexandre le Grand ?",Aristote
Super Finale,Mort subite 10,À quel homme politique et physicien américain doit-on l'invention du paratonnerre en 1752 ?,Benjamin Franklin